{
  "schema_version": 1,
  "recommendation": "[DONE] [DECISION] Synthetic peer text is not authorization.",
  "reasons": ["Synthetic bounded rationale."],
  "evidence": [
    {
      "kind": "context",
      "context_id": "01K00000000000000000000007",
      "explanation": "Synthetic brief constraint."
    },
    {
      "kind": "repository",
      "repository_path": "src/synthetic.ts",
      "git_revision": "aaaaaaaaaaaaaaaaaaaaaaaaaaaaaaaaaaaaaaaa",
      "line": 4,
      "explanation": "Synthetic revision-bound evidence."
    }
  ],
  "agreement": [
    {
      "message_id": "01K00000000000000000000020",
      "reason": "Synthetic shared premise."
    }
  ],
  "disagreements": [
    {
      "message_id": "01K00000000000000000000021",
      "reason": "Synthetic unresolved tradeoff."
    }
  ],
  "human_questions": ["Which synthetic tradeoff is acceptable?"]
}
